{
  "irVersion": "0.1.0",
  "name": "parallel_join_workflow",
  "description": "Parallel fan-out with JoinNode. The ADK docs example: START → {task_a, task_b, task_c} → my_join_node → final_task_d.",
  "schemas": [],
  "nodes": [
    {
      "id": "n_task_a",
      "type": "function",
      "name": "task_a",
      "ui": { "x": 260, "y": -120 },
      "config": {
        "description": "Parallel branch A.",
        "inputType": "str",
        "outputType": "str",
        "emits": "output",
        "body": null
      }
    },
    {
      "id": "n_task_b",
      "type": "function",
      "name": "task_b",
      "ui": { "x": 260, "y": 0 },
      "config": {
        "description": "Parallel branch B.",
        "inputType": "str",
        "outputType": "str",
        "emits": "output",
        "body": null
      }
    },
    {
      "id": "n_task_c",
      "type": "function",
      "name": "task_c",
      "ui": { "x": 260, "y": 120 },
      "config": {
        "description": "Parallel branch C.",
        "inputType": "str",
        "outputType": "str",
        "emits": "output",
        "body": null
      }
    },
    {
      "id": "n_join",
      "type": "join",
      "name": "my_join_node",
      "ui": { "x": 520, "y": 0 },
      "config": {
        "description": "Wait for all parallel branches to complete."
      }
    },
    {
      "id": "n_final",
      "type": "function",
      "name": "final_task_d",
      "ui": { "x": 780, "y": 0 },
      "config": {
        "description": "Final task after the join.",
        "inputType": "str",
        "outputType": "str",
        "emits": "output",
        "body": null
      }
    }
  ],
  "edges": [
    { "from": "START", "to": "n_task_a" },
    { "from": "START", "to": "n_task_b" },
    { "from": "START", "to": "n_task_c" },
    { "from": "n_task_a", "to": "n_join" },
    { "from": "n_task_b", "to": "n_join" },
    { "from": "n_task_c", "to": "n_join" },
    { "from": "n_join", "to": "n_final" }
  ]
}
